<?xml version="1.0" encoding="UTF-8"?>
<tns:transcripts xmlns:tns="http://unknown.abc/HW1/transcript"
	xmlns:xsi="http://www.w3.org/2001/XMLSchema-instance"
	xsi:schemaLocation="http://unknown.abc/HW1/transcript ../schema/transcript.xsd ">
	<tns:transcript>
		<tns:name>Jason Borne</tns:name>
		<tns:university>MIT</tns:university>
		<tns:degree>PHD in CS</tns:degree>
		<tns:year>2016</tns:year>
		<tns:courses>
			<tns:course CourseName="C++ Programming">
				<tns:score>93</tns:score>
				<tns:value>4</tns:value>
			</tns:course>
			<tns:course CourseName="Machine leaning">
				<tns:score>87</tns:score>
				<tns:value>5</tns:value>
			</tns:course>
			<tns:course CourseName="Data Structure">
				<tns:score>93</tns:score>
				<tns:value>4</tns:value>
			</tns:course>
			<tns:course CourseName="Operatin System">
				<tns:score>81</tns:score>
				<tns:value>3</tns:value>
			</tns:course>
		</tns:courses>
	</tns:transcript>

	<tns:transcript>
		<tns:name>Harry Potter</tns:name>
		<tns:university>Cambridge University</tns:university>
		<tns:degree>Master of Physics</tns:degree>
		<tns:year>2000</tns:year>
		<tns:courses>
			<tns:course CourseName="Physics">
				<tns:score>99</tns:score>
				<tns:value>6</tns:value>
			</tns:course>
			<tns:course CourseName="Experiment Principle">
				<tns:score>87</tns:score>
				<tns:value>4.5</tns:value>
			</tns:course>
			<tns:course CourseName="Rifle Shooting">
				<tns:score>100</tns:score>
				<tns:value>5.5</tns:value>
			</tns:course>
			<tns:course CourseName="Jet Piloting">
				<tns:score>100</tns:score>
				<tns:value>4.5</tns:value>
			</tns:course>
		</tns:courses>
	</tns:transcript>

</tns:transcripts>
